{
  "$schema": "./case-schema.json",
  "version": "1.0.0",
  "incident": {
    "title": "REPLACE: short incident title",
    "risk": "medium",
    "agentName": "REPLACE: agent display name",
    "agentId": "REPLACE: agent ID (e.g. AgentsInfo.AgentId)",
    "agentIdentity": "REPLACE: agent identity UPN or service principal name",
    "initiatingUser": "REPLACE: user@domain",
    "conversationId": "REPLACE: gen_ai.conversation.id or ConversationId",
    "investigationConfidencePercent": 50
  },
  "steps": [
    {
      "actor": "REPLACE: who/what took the first action",
      "action": "REPLACE: what happened",
      "evidenceType": "exact"
    },
    {
      "actor": "REPLACE: next actor in the chain",
      "action": "REPLACE: what this actor did",
      "evidenceType": "correlated",
      "confidencePercent": 80
    }
  ],
  "evidenceTable": [
    {
      "time": "00:00:00",
      "entity": "REPLACE",
      "action": "REPLACE",
      "evidence": "REPLACE: e.g. Agent 365 span / Identity + time correlation / Audit evidence",
      "confidencePercent": 100,
      "sourceTable": "REPLACE: e.g. AppDependencies, CloudAppEvents, BehaviorInfo, AgentsInfo"
    }
  ],
  "anomalies": [
    {
      "title": "REPLACE: short anomaly name",
      "description": "REPLACE: why this is unusual",
      "baseline": "REPLACE: prior/expected behavior (optional)",
      "current": "REPLACE: observed behavior (optional)"
    }
  ],
  "blastRadius": {
    "rootLabel": "1 Agent",
    "branches": [
      { "label": "REPLACE: affected resource type", "count": 0 }
    ]
  },
  "recommendation": {
    "priority": "medium",
    "investigate": [
      "REPLACE: first thing an analyst should check"
    ]
  }
}
